{
  "schema": "underlay.migration.decision_reuse_summary.v1",
  "schema_version": 1,
  "generated_at": "2026-03-02T12:30:00Z",
  "project_name": "acowtancy",
  "run_scope": "refresh",
  "run_date_utc": "2026-03-02",
  "reuse_from_digest_ref": "registry.example.com/underlay/site-migration@sha256:bbbbbbbbbbbbbbbbbbbbbbbbbbbbbbbbbbbbbbbbbbbbbbbbbbbbbbbbbbbbbbbb",
  "reuse_stats": {
    "reused_count": 2360,
    "new_count": 120,
    "invalidated_count": 18,
    "unresolved_count": 6
  },
  "sidecar_merge": {
    "deduped_count": 2200,
    "replaced_count": 140,
    "invalidated_count": 18,
    "corrupted_count": 0
  },
  "suppression_kpi": {
    "candidate_decisions_total": 2480,
    "reused_decisions_total": 2360,
    "new_ai_calls_total": 96,
    "new_human_required_total": 6,
    "invalidated_decisions_total": 18,
    "ai_call_suppression_ratio": 0.96129,
    "reuse_ratio": 0.95161,
    "human_queue_ratio": 0.00242
  },
  "targets": {
    "ai_call_suppression_ratio_min": 0.85,
    "reuse_ratio_min": 0.8,
    "human_queue_ratio_max": 0.05
  }
}
